{
	"id": "WaterLevelAndRiverFlow-201711071221",
	"type": "WaterLevelAndRiverFlow",
	"entity": "Y6042010",
	"dateLastValueReported": "2016-06-29T15:59:09.22Z",
	"location": {
		"coordinates": [7.26985643, 43.69770086],
		"type": "Point"
	},
	"measurand": [ "H, Hauteur", "Q, Quantité en m3"],
	"H": "-0.086",
	"Q":"7.700"
}